{
    "$schema": "../../../../Reporting/src/Adriva.Extensions.Reporting.Abstractions/report-schema.json",
    "base": "basereport",
    "name": "Random Users 1",
    "commands": {
        "getRandomUsers": {
            "commandText": "/api/?nat=@nationalities&results=@pageSize",
            "options": {
                "dataElement": "results",
                "method": "GET"
            }
        }
    },
    "filters": {
        "nationalities": {
            "defaultValue": "us,dk,fr,gb",
            "dataType": "String"
        },
        "pageSize": {
            "defaultValue": 1000,
            "dataType": "Int32"
        }
    },
    "output": {
        "command": "getRandomUsers",
        "dataSource": "randomUser",
        "fields": {
            "id.name": {
                "displayName": "Id"
            },
            "name.first": {
                "displayName": "First Name"
            },
            "name.last": {
                "displayName": "Last Name"
            }
        },
        "options": {
            "XlsxRenderer": {}
        }
    }
}